{
  "clock_skew_seconds": 30,
  "deployment_id": "wave16-local-demo",
  "expires_at": "2027-10-01T01:04:31.232398+00:00",
  "keys": [
    {
      "algorithm": "Ed25519",
      "key_id": "wave16-demo-key",
      "not_after": "2027-10-01T01:04:31.232398+00:00",
      "not_before": "2026-10-01T00:59:31.232398+00:00",
      "public_key_pem": "-----BEGIN PUBLIC KEY-----\nMCowBQYDK2VwAyEATbUvWxsPCMbYuD01D8+rrbckcFw0foO76JzLFxvY5zk=\n-----END PUBLIC KEY-----\n",
      "revoked": false,
      "spki_sha256": "7962c1526ce9a8a6e6fe67fd10618b448e6df436f51b2adaccc9b1ff5c3f8abb"
    }
  ],
  "schema_version": "wave16.trust_policy.v1",
  "stream_id": "wave16-demo-stream"
}
