{
  "clock_skew_seconds": 30,
  "deployment_id": "wave16-local-demo",
  "expires_at": "2027-10-01T01:04:34.643946+00:00",
  "keys": [
    {
      "algorithm": "Ed25519",
      "key_id": "wave16-demo-key",
      "not_after": "2027-10-01T01:04:34.643946+00:00",
      "not_before": "2026-10-01T00:59:34.643946+00:00",
      "public_key_pem": "-----BEGIN PUBLIC KEY-----\nMCowBQYDK2VwAyEAwNlN596NVIJN8Pvzgyo8eOvQZG14cuCngz/0Hh83hQM=\n-----END PUBLIC KEY-----\n",
      "revoked": false,
      "spki_sha256": "07676d3d87970966e689f4fba89682fa6736e3136b01a41382c62a373ee22e11"
    }
  ],
  "schema_version": "wave16.trust_policy.v1",
  "stream_id": "wave16-demo-stream"
}
